{
  "version": 1,
  "trackId": "fixture-track-001",
  "sampleRate": 48000,
  "duration": 30.0,
  "profile": "modern_pop_polish",
  "sections": [
    {
      "id": "sec-1",
      "type": "intro",
      "startSec": 0,
      "endSec": 8,
      "loudnessLufs": -16.0,
      "spectralCentroidHz": 1200
    },
    {
      "id": "sec-2",
      "type": "verse",
      "startSec": 8,
      "endSec": 18,
      "loudnessLufs": -14.5,
      "spectralCentroidHz": 1450
    },
    {
      "id": "sec-3",
      "type": "chorus",
      "startSec": 18,
      "endSec": 30,
      "loudnessLufs": -12.0,
      "spectralCentroidHz": 1800
    }
  ],
  "moves": [
    {
      "id": "mv-1",
      "param": "master.compressor.threshold",
      "startSec": 0,
      "endSec": 30,
      "envelope": [
        [0, -24],
        [8, -24],
        [8.2, -22],
        [18, -22],
        [18.2, -19],
        [30, -19]
      ],
      "reason": "Lift threshold on chorus for more glue",
      "original": -22,
      "edited": false,
      "muted": false
    },
    {
      "id": "mv-2",
      "param": "master.eq.band5.gain",
      "startSec": 0,
      "endSec": 30,
      "envelope": [
        [0, 0],
        [18, 0],
        [18.2, 1.5],
        [30, 1.5]
      ],
      "reason": "Add air on chorus",
      "original": 1.5,
      "edited": false,
      "muted": false
    },
    {
      "id": "mv-3",
      "param": "master.stereoWidth.width",
      "startSec": 0,
      "endSec": 30,
      "envelope": [
        [0, 1.0],
        [18, 1.0],
        [18.2, 1.2],
        [30, 1.2]
      ],
      "reason": "Wider chorus image",
      "original": 1.2,
      "edited": false,
      "muted": false
    }
  ]
}
